dimension	weight	score_4	score_3	score_2	score_1	critical_fail
pv_sense_dependency	25	Response depends on hearing the PV, retrieving the intended sense, and judging its local semantic/collocational fit.	Response mostly depends on the PV sense, with a minor non-target cue that can be revised.	Response can often be solved from broad noun category, world knowledge, or general plausibility without the PV sense.	Response barely depends on the PV sense.	Unacceptable item is rejectable from absurdity alone or acceptable item does not require the target PV sense.
near_miss_quality	20	Unacceptable item is a same-domain near-miss with plausible syntax and semantics except for the target PV fit.	Near-miss is mostly same-domain but one complement/role is slightly too obvious.	Near-miss uses a broad category mismatch or repeated generic wrong object.	Near-miss is nonsense, impossible, or comical.	Unacceptable sentence would be rejected by C1 listeners before processing the PV.
cue_control	15	No overt contrast, negation, number reversal, animacy cue, rare noun cue, or discourse cue reveals the answer.	One weak cue is present but removable.	Several cues make the answer predictable.	Cues dominate the judgment.	Overt wording directly signals the key.
polysemy_alternate_sense_control	15	No common alternate PV sense makes the keyed unacceptable sentence acceptable.	Alternate reading is remote and can be blocked by a small revision.	Alternate reading is plausible for some speakers or registers.	Alternate reading is common.	Native/expert reviewer can naturally accept the keyed unacceptable sentence.
acceptable_naturalness	10	Acceptable sentence is natural, concise, and ordinary for the intended register.	Acceptable sentence is understandable but slightly stiff or less idiomatic.	Acceptable sentence is marginal, dictionary-like, or register-mismatched.	Acceptable sentence sounds unnatural.	Acceptable sentence is not acceptable to native/expert reviewers.
audio_robustness	10	Key is stable under neutral TTS/audio delivery with no special stress or intonation.	Mostly stable, but one pronunciation/prosody risk needs audio review.	Key may depend on stress, pause, or delivery.	Key is highly prosody-dependent.	TTS or speaker prosody can flip the intended judgment.
c1_suitability	5	Target sense is appropriate for C1: challenging but useful, not trivial, not obscure.	Target is usable for high B2-C1 with minor difficulty adjustment.	Target is too easy, too rare, or too specialized for the intended construct.	Target is mismatched to C1 learners.	Target should be replaced for the C-level PV-LJT.
